{
  "title": "Synthetic Linux STIG SCAP Benchmark",
  "id": "8c9c64e4-9da5-5c8f-8506-8199b7cf6fe7",
  "active": false,
  "mode": 1,
  "has_path": true,
  "target_data": {
    "target_type": "Computing",
    "host_name": "web01.example",
    "ip_address": "",
    "mac_address": "",
    "fqdn": "",
    "comments": "Exported by freesecdev.linux_compliance (tools.reporting) from scan run run-oscap (oscap 1.3.9, content ssg-synthetic-ds.xml 0.1.82 sha256 cccccccccccccccccccccccccccccccccccccccccccccccccccccccccccccccc). The host identity (web01.example, ubuntu 24.04, x86_64) and the addresses are self-asserted by the scanned host. Each status aggregates the ComplianceAsCode checks that the STIG mapping of ssg-synthetic-ds.xml (ComplianceAsCode 0.1.82, sha256 cccccccccccccccccccccccccccccccccccccccccccccccccccccccccccccccc) lists for the rule's STIG ID, for DISA release V1R2 (disa.xml): a rule is Not a Finding only when every mapped check passed. 2 finding(s) check no rule of this STIG and are not in the checklist.",
    "role": "None",
    "is_web_database": false,
    "technology_area": "",
    "web_db_site": "",
    "web_db_instance": ""
  },
  "stigs": [
    {
      "stig_name": "Synthetic Linux STIG SCAP Benchmark",
      "display_name": "Synthetic Linux STIG SCAP Benchmark",
      "stig_id": "Synthetic_Linux_STIG",
      "release_info": "Release: 2 Benchmark Date: 01 Oct 2026",
      "version": "001.002.003",
      "uuid": "c2a49e97-0319-5843-9018-da0d09e933e7",
      "size": 10,
      "rules": [
        {
          "uuid": "910df8b4-9b39-56c0-aaab-c49986feab35",
          "stig_uuid": "c2a49e97-0319-5843-9018-da0d09e933e7",
          "target_key": "9999",
          "stig_ref": null,
          "group_id": "V-900001",
          "rule_id": "SV-900001r1",
          "rule_id_src": "SV-900001r1_rule",
          "weight": "10.0",
          "severity": "high",
          "rule_version": "SYN-00-000001",
          "group_title": "SRG-SYN-000001",
          "rule_title": "Synthetic requirement 1 must hold",
          "fix_text": "Synthetic fix 1.",
          "false_positives": "",
          "false_negatives": "",
          "discussion": "Synthetic discussion 1 & notes",
          "check_content": "Synthetic check 1.",
          "documentable": "false",
          "mitigations": "",
          "potential_impacts": "",
          "third_party_tools": "",
          "mitigation_control": "",
          "responsibility": "",
          "security_override_guidance": "",
          "ia_controls": "",
          "check_content_ref": {
            "href": "synthetic-oval.xml",
            "name": "oval:syn:def:1"
          },
          "legacy_ids": [
            "SV-1"
          ],
          "ccis": [
            "CCI-000001"
          ],
          "group_tree": [
            {
              "id": "V-900001",
              "title": "SRG-SYN-000001",
              "description": "<GroupDescription></GroupDescription>"
            }
          ],
          "createdAt": "2026-10-26T10:05:00.000Z",
          "updatedAt": "2026-10-26T10:05:00.000Z",
          "STIGUuid": "c2a49e97-0319-5843-9018-da0d09e933e7",
          "status": "not_a_finding",
          "overrides": {},
          "comments": "",
          "finding_details": "Mapped by STIG ID SYN-00-000001 to 1 ComplianceAsCode check(s) of profile xccdf_org.ssgproject.content_profile_stig:\nComplianceAsCode check xccdf_org.ssgproject.content_rule_one: Not a Finding\n  Scanner result: pass\nScan run run-oscap: oscap 1.3.9, 2026-10-26T10:00:00Z to 2026-10-26T10:05:00Z, profile xccdf_org.ssgproject.content_profile_stig"
        },
        {
          "uuid": "2d489602-b31c-5b38-ae40-48c2d9061409",
          "stig_uuid": "c2a49e97-0319-5843-9018-da0d09e933e7",
          "target_key": "9999",
          "stig_ref": null,
          "group_id": "V-900002",
          "rule_id": "SV-900002r1",
          "rule_id_src": "SV-900002r1_rule",
          "weight": "10.0",
          "severity": "medium",
          "rule_version": "SYN-00-000002",
          "group_title": "SRG-SYN-000002",
          "rule_title": "Synthetic requirement 2 must hold",
          "fix_text": "Synthetic fix 2.",
          "false_positives": "",
          "false_negatives": "",
          "discussion": "Synthetic discussion 2 & notes",
          "check_content": "Synthetic check 2.",
          "documentable": "false",
          "mitigations": "",
          "potential_impacts": "",
          "third_party_tools": "",
          "mitigation_control": "",
          "responsibility": "",
          "security_override_guidance": "",
          "ia_controls": "",
          "check_content_ref": {
            "href": "synthetic-oval.xml",
            "name": "oval:syn:def:2"
          },
          "legacy_ids": [
            "SV-1"
          ],
          "ccis": [
            "CCI-000002"
          ],
          "group_tree": [
            {
              "id": "V-900002",
              "title": "SRG-SYN-000002",
              "description": "<GroupDescription></GroupDescription>"
            }
          ],
          "createdAt": "2026-10-26T10:05:00.000Z",
          "updatedAt": "2026-10-26T10:05:00.000Z",
          "STIGUuid": "c2a49e97-0319-5843-9018-da0d09e933e7",
          "status": "open",
          "overrides": {},
          "comments": "",
          "finding_details": "Mapped by STIG ID SYN-00-000002 to 2 ComplianceAsCode check(s) of profile xccdf_org.ssgproject.content_profile_stig:\nComplianceAsCode check xccdf_org.ssgproject.content_rule_many_fail: Open\n  Scanner result: fail\n  Message: value is 0; expected 1\nComplianceAsCode check xccdf_org.ssgproject.content_rule_many_pass: Not a Finding\n  Scanner result: pass\nScan run run-oscap: oscap 1.3.9, 2026-10-26T10:00:00Z to 2026-10-26T10:05:00Z, profile xccdf_org.ssgproject.content_profile_stig"
        },
        {
          "uuid": "bfb83012-84cd-5bae-8e48-6c0d244e276c",
          "stig_uuid": "c2a49e97-0319-5843-9018-da0d09e933e7",
          "target_key": "9999",
          "stig_ref": null,
          "group_id": "V-900003",
          "rule_id": "SV-900003r1",
          "rule_id_src": "SV-900003r1_rule",
          "weight": "10.0",
          "severity": "low",
          "rule_version": "SYN-00-000003",
          "group_title": "SRG-SYN-000003",
          "rule_title": "Synthetic requirement 3 must hold",
          "fix_text": "Synthetic fix 3.",
          "false_positives": "",
          "false_negatives": "",
          "discussion": "Synthetic discussion 3 & notes",
          "check_content": "Synthetic check 3.",
          "documentable": "false",
          "mitigations": "",
          "potential_impacts": "",
          "third_party_tools": "",
          "mitigation_control": "",
          "responsibility": "",
          "security_override_guidance": "",
          "ia_controls": "",
          "check_content_ref": {
            "href": "synthetic-oval.xml",
            "name": "oval:syn:def:3"
          },
          "legacy_ids": [
            "SV-1"
          ],
          "ccis": [
            "CCI-000003"
          ],
          "group_tree": [
            {
              "id": "V-900003",
              "title": "SRG-SYN-000003",
              "description": "<GroupDescription></GroupDescription>"
            }
          ],
          "createdAt": "2026-10-26T10:05:00.000Z",
          "updatedAt": "2026-10-26T10:05:00.000Z",
          "STIGUuid": "c2a49e97-0319-5843-9018-da0d09e933e7",
          "status": "not_a_finding",
          "overrides": {},
          "comments": "",
          "finding_details": "Mapped by STIG ID SYN-00-000003 to 2 ComplianceAsCode check(s) of profile xccdf_org.ssgproject.content_profile_stig:\nComplianceAsCode check xccdf_org.ssgproject.content_rule_both_a: Not a Finding\n  Scanner result: pass\nComplianceAsCode check xccdf_org.ssgproject.content_rule_both_b: Not a Finding\n  Scanner result: pass\nScan run run-oscap: oscap 1.3.9, 2026-10-26T10:00:00Z to 2026-10-26T10:05:00Z, profile xccdf_org.ssgproject.content_profile_stig"
        },
        {
          "uuid": "f90f2596-56f2-5f15-8015-45a9eca5d6c3",
          "stig_uuid": "c2a49e97-0319-5843-9018-da0d09e933e7",
          "target_key": "9999",
          "stig_ref": null,
          "group_id": "V-900004",
          "rule_id": "SV-900004r1",
          "rule_id_src": "SV-900004r1_rule",
          "weight": "10.0",
          "severity": "medium",
          "rule_version": "SYN-00-000004",
          "group_title": "SRG-SYN-000004",
          "rule_title": "Synthetic requirement 4 must hold",
          "fix_text": "Synthetic fix 4.",
          "false_positives": "",
          "false_negatives": "",
          "discussion": "Synthetic discussion 4 & notes",
          "check_content": "Synthetic check 4.",
          "documentable": "false",
          "mitigations": "",
          "potential_impacts": "",
          "third_party_tools": "",
          "mitigation_control": "",
          "responsibility": "",
          "security_override_guidance": "",
          "ia_controls": "",
          "check_content_ref": {
            "href": "synthetic-oval.xml",
            "name": "oval:syn:def:4"
          },
          "legacy_ids": [
            "SV-1"
          ],
          "ccis": [
            "CCI-000004"
          ],
          "group_tree": [
            {
              "id": "V-900004",
              "title": "SRG-SYN-000004",
              "description": "<GroupDescription></GroupDescription>"
            }
          ],
          "createdAt": "2026-10-26T10:05:00.000Z",
          "updatedAt": "2026-10-26T10:05:00.000Z",
          "STIGUuid": "c2a49e97-0319-5843-9018-da0d09e933e7",
          "status": "not_reviewed",
          "overrides": {},
          "comments": "",